Project Name,Description
SolarFuture,SolarFuture aims to provide affordable solar energy solutions to off-grid communities reducing dependence on fossil fuels and increasing access to electricity.
EduTech Connect,EduTech Connect leverages technology to deliver quality education to remote and underserved communities focusing on STEM subjects and digital literacy.
GreenHouse Homes,GreenHouse Homes is a project that develops sustainable and affordable housing units using eco-friendly materials and energy-efficient designs.
MarineLife Guardians,MarineLife Guardians is dedicated to protecting marine biodiversity through community-based conservation efforts research and education.
OrganiFarm Co-op,OrganiFarm Co-op promotes sustainable agriculture by supporting small-scale farmers in transitioning to organic farming practices and connecting them to fair markets.
WomenTech Makers,WomenTech Makers empowers women and girls by providing them with coding and tech skills fostering gender diversity in the technology sector.
AI Ethics Watch,AI Ethics Watch is a project that aims to ensure ethical and responsible development of artificial intelligence through research advocacy and policy development.
TeleMental Health,TeleMental Health provides accessible mental health services to individuals in remote and underserved areas through telemedicine and digital platforms.
CleanWater Initiative,CleanWater Initiative works to provide clean drinking water and sanitation facilities to communities in need using innovative and sustainable technologies.
Digital Lifeline,Digital Lifeline bridges the digital divide by providing internet access and digital tools to underserved communities promoting digital inclusion and opportunities.
ClimateAction Hub,ClimateAction Hub supports local climate change mitigation and adaptation projects focusing on reforestation carbon sequestration and resilience-building activities.
Refugee Support Network,Refugee Support Network offers legal assistance education and job training to refugees and asylum seekers promoting social justice and human rights.
ZeroWaste City,ZeroWaste City is a project that aims to transform cities into zero-waste communities through waste reduction recycling and composting initiatives.
MicroFinance Plus,MicroFinance Plus offers microloans and financial services to low-income individuals and small businesses fostering economic empowerment and financial inclusion.
SmartCity Solutions,SmartCity Solutions develops and implements smart and sustainable urban solutions focusing on green spaces public transport and energy-efficient infrastructure.
Solar Now!,Project aims to install rooftop solar panels on low-income housing units reducing energy costs and promoting renewable energy adoption.
Telemedicine for Rural Communities,Initiative seeks to create a telemedicine platform connecting rural patients with doctors in urban areas improving access to healthcare in remote locations.
Girls STEM Academy,Academy empowers girls in a developing country by providing after-school STEM education and mentorship programs.
Community Kitchen and Job Training Center,Project revitalizes a distressed neighborhood by offering a community kitchen serving healthy meals and providing job training programs for residents.
Ethical Fashion Marketplace,Online platform connects consumers with ethically sourced clothing brands that prioritize fair wages sustainable practices and transparent supply chains.
Mobile Literacy App for Adults,App provides a user-friendly platform for adults to learn basic literacy skills and improve their reading comprehension.
Microloans for Women Entrepreneurs,Project provides microloans and business training to female entrepreneurs in developing countries fostering economic empowerment.
Rainwater Harvesting Initiative,Initiative installs rainwater harvesting systems in drought-stricken communities promoting water security and sustainable water management.
Plant-Based Meal Delivery Service,Service delivers delicious and nutritious plant-based meals to customers promoting healthy eating habits and reducing environmental impact.
Affordable Housing Cooperative,Project builds and manages a cooperative housing complex offering low-cost energy-efficient apartments for low-income families.
Bridging the Digital Divide,Initiative provides free Wi-Fi hotspots and digital literacy training in underserved communities promoting access to technology and bridging the digital divide.
Inclusive Playground Project,Project builds a fully accessible playground with equipment designed for children of all abilities fostering inclusivity and social interaction.
Reviving Traditional Crafts,Program assists artisans in a developing country to adapt their traditional handicraft skills to modern markets preserving cultural heritage and promoting economic opportunities.
Refugee Skills Training and Job Placement,Project provides job skills training and employment placement assistance to refugees facilitating their integration into the workforce and fostering self-sufficiency.
Sustainable Vertical Farming Initiative,Initiative utilizes innovative vertical farming techniques to grow fresh produce in urban areas promoting local food production and reducing environmental impact.
Solar Schools Initiative,Aims to install solar panels on school rooftops to generate clean energy reduce carbon emissions lower electricity costs and educate students about renewable energy and environmental sustainability.
Health Equity Clinic Expansion,Seeks to expand access to quality healthcare services in underserved communities by establishing new clinics upgrading existing facilities addressing healthcare disparities and improving healthcare infrastructure to promote health equity.
Urban Agriculture Hub,Transforms vacant lots and unused spaces in urban areas into productive agricultural hubs that support local food production provide fresh produce to residents create green spaces and promote community engagement through gardening and educational programs enhancing food security promoting sustainable living and strengthening community resilience.
Clean Water Access Initiative,Aims to provide clean and safe drinking water to communities facing water scarcity and contamination challenges through water purification systems well drilling and sanitation infrastructure improvements addressing water-related health risks enhancing quality of life and promoting sustainable water management practices.
Renewable Energy Microgrids,Deploys decentralized energy systems powered by renewable sources like solar and wind to electrify off-grid and remote communities enhancing energy access reducing dependence on fossil fuels stimulating local economic development and mitigating climate change impacts.
Affordable Housing Initiative,Aims to address the affordable housing crisis by developing affordable housing units for low-income individuals and families Through partnerships this project constructs affordable rental apartments and homeownership opportunities providing stable housing options and promoting inclusive and vibrant communities.
Digital Literacy Program,Bridges the digital divide by providing digital literacy training and access to technology resources to underserved populations Equipping participants with essential digital skills this program empowers them to participate in the digital economy and access educational and economic opportunities.
Marine Conservation Initiative,Focuses on protecting and restoring marine ecosystems including coral reefs mangroves and marine biodiversity hotspots Through marine protected areas sustainable fisheries management and community engagement this project conserves marine resources supports coastal livelihoods and enhances resilience to climate change impacts.
Vocational Training Center Expansion,Expands vocational training facilities and programs to provide skills training and job placement assistance to youth and adults in underserved areas Offering training in marketable skills this project equips individuals for gainful employment and economic self-sufficiency.
Sustainable Tourism Development,Promotes responsible and sustainable tourism practices in ecologically sensitive areas By developing eco-friendly accommodations implementing waste management initiatives and supporting local community enterprises this project balances tourism growth with environmental conservation preserving cultural heritage and generating economic benefits for local communities.
Community Renewable Energy Cooperative,Establishes community-owned renewable energy projects such as solar cooperatives and wind farms to democratize energy production and distribution Through community participation and shared ownership this project empowers local residents to invest in clean energy reduce energy costs and build resilience to energy disruptions while contributing to a sustainable energy future.
Sustainable Agriculture Training Program,Provides farmers with training and resources to adopt sustainable farming practices that promote soil health water conservation and biodiversity conservation Incorporating agroecological principles and techniques this project enhances agricultural productivity resilience to climate change and environmental sustainability while improving farmers' livelihoods and food security.
Social Enterprise Incubator,Supports the development and growth of social enterprises that address pressing social and environmental challenges Through mentorship training and access to financing this project helps aspiring entrepreneurs launch and scale ventures that create positive social impact while generating financial returns fostering innovation and building a more inclusive and sustainable economy.
Climate-Resilient Infrastructure Upgrade,Upgrades critical infrastructure such as roads bridges and water systems to withstand the impacts of climate change including extreme weather events and sea-level rise Integrating climate resilience measures this project enhances infrastructure resilience reduces disaster risks and ensures the continued functionality of essential services in the face of climate-related threats.
Environmental Education Campaign,Raises awareness and promotes environmental stewardship through educational outreach and public engagement initiatives Through workshops seminars and multimedia campaigns this project educates individuals and communities about environmental issues conservation practices and sustainable living choices inspiring collective action to protect the environment.
Sustainable Agriculture Initiative,A project that trains smallholder farmers in sustainable farming practices such as agroforestry and organic pest management to improve crop yields increase incomes and promote environmental conservation.
Digital Literacy for Underserved Youth,An initiative that provides free digital literacy training and access to technology for underserved youth in urban areas empowering them with the skills needed to succeed in the digital economy.
Affordable Housing Development,A project that constructs high-quality energy-efficient affordable housing units in areas with limited access to decent and affordable shelter ensuring that low-income families have access to safe and stable homes.
Maternal and Child Health Clinics,An initiative that establishes community-based maternal and child health clinics in remote areas providing essential prenatal care postnatal care and pediatric services to improve health outcomes for mothers and children.
Renewable Energy Access for Rural Communities,A project that installs solar home systems and micro-grids in off-grid rural communities providing affordable and reliable access to clean energy and reducing reliance on kerosene and firewood.
Vocational Training for Refugees,An initiative that offers vocational training and job placement assistance to refugees helping them develop skills in high-demand industries and facilitating their economic integration into host communities.
Waste Management and Recycling Cooperative,A project that establishes a community-owned waste management and recycling cooperative in urban slums creating employment opportunities improving sanitation and reducing the environmental impact of waste.
Microfinance for Women Entrepreneurs,An initiative that provides small loans savings services and business training to women entrepreneurs in developing countries enabling them to start and grow their own businesses and achieve financial independence.
Inclusive Education for Children with Disabilities,A project that promotes inclusive education by training teachers adapting curricula and providing assistive technologies to ensure that children with disabilities have access to quality education in mainstream schools.
Sustainable Forestry and Ecotourism,An initiative that supports sustainable forestry practices and develops ecotourism opportunities in biodiversity-rich areas generating income for local communities while promoting environmental conservation.
Affordable Clean Water Access,A project that installs water purification systems and builds water distribution infrastructure in areas with limited access to clean water ensuring that households have affordable and reliable access to safe drinking water.
Youth Leadership and Civic Engagement,An initiative that empowers youth to become active citizens and leaders in their communities through civic education community service projects and advocacy training fostering a culture of youth-led social change.
Sustainable Urban Agriculture,A project that establishes urban farms and community gardens in underutilized urban spaces providing fresh produce to local residents creating green jobs and promoting sustainable food systems in cities.
Affordable Healthcare for the Elderly,An initiative that provides affordable primary healthcare services and long-term care for the elderly in underserved communities ensuring that older adults have access to essential health services and maintain their dignity and independence.
Financial Inclusion for Smallholder Farmers,A project that connects smallholder farmers to digital financial services such as mobile money crop insurance and savings accounts enabling them to manage risks invest in their farms and improve their livelihoods.